{
  "schemaVersion": 1,
  "type": "logicTree",
  "title": "応募が書類選考に進まないケース",
  "nodes": [
    {
      "id": "node_Aa1Bb2Cc3D",
      "parentId": null,
      "text": "応募が書類選考に進まないのはどんなときか"
    },
    {
      "id": "node_Ee4Ff5Gg6H",
      "parentId": "node_Aa1Bb2Cc3D",
      "text": "応募そのものが成立しない"
    },
    {
      "id": "node_Ii7Jj8Kk9L",
      "parentId": "node_Ee4Ff5Gg6H",
      "text": "応募フォームの送信に失敗した"
    }
  ]
}
